{
  "schemaVersion": "clearcutt.catalog.image/v1",
  "id": "java21-distroless",
  "language": {
    "id": "java",
    "displayName": "Java",
    "version": "21",
    "icon": null
  },
  "tier": {
    "id": "distroless",
    "name": "Distroless",
    "blurb": "Hardened tier"
  },
  "registry": "ghcr.io/test-owner/test-repo",
  "imageName": "clearcutt-java",
  "fullName": "ghcr.io/test-owner/test-repo/clearcutt-java",
  "lifecycle": {
    "status": "active",
    "support": "lts",
    "productionAllowed": true,
    "deprecatedAt": null,
    "eolAt": null,
    "reason": null
  },
  "runtimeContract": {
    "user": "10001",
    "workingDir": "/app",
    "shellPresent": false,
    "packageManagerPresent": false,
    "caCertificatesPresent": true,
    "timezoneDataPresent": true,
    "defaultEntrypoint": "/usr/local/bin/java",
    "productionTier": true
  },
  "releases": [
    {
      "tag": "v1.0.0",
      "publishedAt": "2026-05-29T20:00:00Z",
      "isLatest": true,
      "manifestDigest": "sha256:1234567890abcdef1234567890abcdef1234567890abcdef1234567890abcdef",
      "totalSize": 20480,
      "architectures": [
        {
          "arch": "amd64",
          "os": "linux",
          "imageDigest": "sha256:abcdef",
          "imageSize": 10240,
          "layerCount": 2,
          "layers": [
            { "digest": "sha256:layer1", "size": 5120 }
          ],
          "labels": {},
          "sbom": {
            "tool": "syft",
            "createdAt": "2026-05-29T20:00:00Z",
            "packageCount": 2,
            "packages": [
              {
                "name": "openssl",
                "version": "3.0.8",
                "cpes": [],
                "license": "Apache-2.0",
                "supplier": "Nix",
                "spdxId": "SPDXRef-openssl"
              }
            ]
          },
          "testResults": {
            "status": "passed",
            "timestamp": "2026-05-29T20:00:00Z",
            "assertions": []
          },
          "vulnerabilities": {
            "scannedAt": "2026-05-29T20:00:00Z",
            "scanner": "grype",
            "countsBySeverity": {
              "critical": 0,
              "high": 0,
              "medium": 0,
              "low": 0,
              "negligible": 0,
              "unknown": 0
            },
            "findings": [
              {
                "id": "CVE-2026-9999",
                "severity": "high",
                "packageName": "openssl",
                "packageVersion": "3.0.8",
                "layer": "base",
                "fixedIn": null,
                "fixState": "deferred",
                "remediation": {
                  "status": "deferred",
                  "reason": "base_layer",
                  "summary": "This is in a base layer and we defer it."
                }
              }
            ]
          }
        }
      ],
      "signature": {
        "cosignBundlePresent": true,
        "certificate": {
          "subject": "https://github.com/test-owner/test-repo/.github/workflows/release.yml@refs/heads/main",
          "issuer": "https://token.actions.githubusercontent.com"
        }
      },
      "provenance": {
        "predicateType": "https://slsa.dev/provenance/v1",
        "builder": { "id": "test-builder" },
        "slsaLevel": 3
      },
      "attestations": [],
      "assetUrls": {
        "sbom": {},
        "provenance": null,
        "testResults": {},
        "digest": null
      },
      "evidence": {
        "signature": true,
        "provenance": true,
        "sbom": true,
        "tests": true,
        "vulnerabilities": true,
        "archCount": 1,
        "sbomArchCount": 1,
        "testArchCount": 1,
        "passedTestArchCount": 1,
        "vulnerabilityArchCount": 1
      },
      "lifecycle": {
        "status": "active",
        "support": "lts",
        "productionAllowed": true,
        "deprecatedAt": null,
        "eolAt": null,
        "reason": null
      },
      "runtimeContract": {
        "user": "10001",
        "workingDir": "/app",
        "shellPresent": false,
        "packageManagerPresent": false,
        "caCertificatesPresent": true,
        "timezoneDataPresent": true,
        "defaultEntrypoint": "/usr/local/bin/java",
        "productionTier": true
      },
      "exceptions": {
        "total": 0,
        "expired": 0,
        "active": 0,
        "acceptedRisk": 0,
        "noFixAvailable": 0,
        "falsePositive": 0,
        "inheritedFromBase": 0
      }
    }
  ]
}
