{
  "schemaVersion": "clearcutt.catalog.image/v1",
  "id": "java21-dev",
  "language": {
    "id": "java",
    "displayName": "Java",
    "version": "21"
  },
  "tier": {
    "id": "dev",
    "name": "Dev",
    "blurb": "Builder tier with shells and toolchains."
  },
  "registry": "ghcr.io/acme/clearcutt",
  "imageName": "clearcutt-java21",
  "fullName": "ghcr.io/acme/clearcutt/clearcutt-java21",
  "lifecycle": {
    "status": "active",
    "support": "lts",
    "productionAllowed": false,
    "deprecatedAt": null,
    "eolAt": null,
    "reason": null
  },
  "runtimeContract": {
    "user": "10001",
    "workingDir": "/app",
    "shellPresent": true,
    "packageManagerPresent": true,
    "caCertificatesPresent": true,
    "timezoneDataPresent": true,
    "defaultEntrypoint": "/usr/local/bin/java",
    "productionTier": false
  },
  "releases": [
    {
      "tag": "v1.2.3",
      "publishedAt": "2026-06-01T00:00:00Z",
      "isLatest": true,
      "manifestDigest": "sha256:aaaaaaaaaaaaaaaaaaaaaaaaaaaaaaaaaaaaaaaaaaaaaaaaaaaaaaaaaaaaaaaa",
      "architectures": [],
      "attestations": [],
      "assetUrls": {
        "sbom": {},
        "provenance": null,
        "testResults": {},
        "digest": null
      },
      "lifecycle": {
        "status": "active",
        "support": "lts",
        "productionAllowed": false,
        "deprecatedAt": null,
        "eolAt": null,
        "reason": null
      },
      "runtimeContract": {
        "user": "10001",
        "workingDir": "/app",
        "shellPresent": true,
        "packageManagerPresent": true,
        "caCertificatesPresent": true,
        "timezoneDataPresent": true,
        "defaultEntrypoint": "/usr/local/bin/java",
        "productionTier": false
      },
      "exceptions": {
        "total": 0,
        "expired": 0,
        "active": 0,
        "acceptedRisk": 0,
        "noFixAvailable": 0,
        "falsePositive": 0,
        "inheritedFromBase": 0
      }
    }
  ]
}
